name,location,latitude,longitude,distance_km,elevation_gain_m,surface,difficulty,avg_time_min,description,waypoints
Han River Riverside Path,"Seoul, Yeouido",37.5285,126.9326,7.2,18,Asphalt / Cycle Path,Beginner,43,"A flat, scenic loop along the Han River. Perfect for beginners or easy recovery runs. Well-lit and open year-round.","37.5285,126.9326;37.5295,126.9280;37.5310,126.9230;37.5300,126.9180;37.5270,126.9170;37.5250,126.9220;37.5260,126.9280;37.5285,126.9326"
Bukhansan Forest Trail,"Seoul, Dobonggu",37.6584,126.9772,12.5,680,Dirt Trail / Rock,Advanced,110,"A challenging mountain trail inside Bukhansan National Park. Technical rocky sections demand trail shoes and careful footing.","37.6584,126.9772;37.6620,126.9800;37.6650,126.9830;37.6680,126.9810;37.6660,126.9770;37.6620,126.9750;37.6584,126.9772"
Namsan Circular Loop,"Seoul, Yongsan",37.5512,126.9882,5.8,195,Paved Road / Dirt,Intermediate,52,"A popular loop circumnavigating Namsan (N Seoul Tower). Moderate climb with panoramic city views at the summit.","37.5512,126.9882;37.5540,126.9900;37.5560,126.9870;37.5545,126.9840;37.5520,126.9850;37.5512,126.9882"
Olympic Park Track,"Seoul, Songpa",37.5206,127.1216,3.0,5,Urethane Track,Beginner,18,"A smooth 400 m urethane track inside Olympic Park. Ideal for interval training and easy on the joints.","37.5206,127.1216;37.5215,127.1230;37.5210,127.1245;37.5198,127.1240;37.5195,127.1222;37.5206,127.1216"
Achasan Ridge Run,"Seoul, Gwangjin",37.5560,127.0965,8.9,320,Dirt Trail / Wooden Boardwalk,Intermediate,75,"A scenic ridge trail in eastern Seoul with city skyline views. Wooden boardwalks on steeper sections keep the descent manageable.","37.5560,127.0965;37.5590,127.0990;37.5620,127.1010;37.5600,127.0975;37.5575,127.0950;37.5560,127.0965"
Cheonggyecheon Streamside Path,"Seoul, Jongno",37.5696,126.9784,5.4,8,Concrete / Stone,Beginner,32,"A cool, shaded urban run along the restored Cheonggyecheon Stream. Flat and refreshing — ideal for hot summer days.","37.5696,126.9784;37.5700,126.9830;37.5705,126.9880;37.5710,126.9930;37.5715,126.9980;37.5710,127.0030"
Dobongsan Summit Push,"Seoul, Dobong",37.6890,127.0460,15.3,890,Rock / Dirt Trail,Advanced,145,"One of the toughest routes in Seoul, ascending to Dobongsan's granite peaks. Serious scrambling required near the top.","37.6890,127.0460;37.6920,127.0490;37.6960,127.0520;37.6990,127.0500;37.6950,127.0470;37.6910,127.0450;37.6890,127.0460"
